Table 4. Cardiovascular outcome in women with polycystic ovary syndrome (PCOS).,,,,,,
Study,Type of Study,PCOS (n),Control (n),Mean Age,Mean Follow-Up,Results
Ollila [86],Prospective,346,N/A,31 *,22 years,Increased risk of major cardiovascular event and myocardial infarction.
Berni [82],Retrospective,"174,660","174,600",29 *,N/A,"Increased risk of composite cardiovascular event, myocardial infarction, angina, and revascularization."
Mahboobifard [84],Prospective,356,1335,29.7,15.4 years,PCOS did not increase silent coronary heart disease; PCOS reduced incidence of cardiovascular disease.
Lo [83],Retrospective,"11,035","55,175",30.7,N/A,"No difference in coronary artery disease, cerebrovascular disease, and peripheral vascular disease."
"Abbreviations: PCOS, polycystic ovary syndrome; N/A, not applicable. * Baseline.",,,,,,
